{
  "schema_version": "3.0",
  "metric_key": "receivables.balance",
  "display_name": "应收余额",
  "definition_version": "1.0.0",
  "site_id": "gbos.localhost",
  "status": "unavailable",
  "unavailable_reason": "stale",
  "as_of": "2026-08-01T00:00:00Z",
  "queried_at": "2026-08-06T16:05:00Z",
  "window": {
    "type": "point_in_time",
    "grain": "instant",
    "start": "2026-08-01T00:00:00Z",
    "end": "2026-08-01T00:00:00Z"
  },
  "freshness": {
    "status": "stale",
    "age_seconds": 489900,
    "slo_seconds": 86400
  },
  "coverage": {
    "status": "sufficient",
    "ratio": 1,
    "included_count": 2,
    "total_count": 2
  },
  "reconciliation": {
    "status": "passed",
    "checked_at": "2026-08-01T00:01:00Z",
    "reference": "recon-receivables-stale-synthetic",
    "variance": 0
  },
  "source_lineage": [
    {
      "source_system": "kingdee-gate5-synthetic",
      "source_record_refs": [
        "receivable-synthetic-0001",
        "receivable-synthetic-0002"
      ],
      "retrieved_at": "2026-08-01T00:00:00Z",
      "transformation_version": "metrics-projection-v1",
      "evidence_status": "synthetic"
    }
  ],
  "source_mode": "synthetic",
  "synthetic": true,
  "governed_sources": true
}
